{
  "schemaVersion": 1,
  "taskId": "TASK-2026-001",
  "from": "codex-phase-10",
  "to": "authorized-human-reviewer",
  "completed": [
    "Phases 0-10 implemented",
    "clean-checkout verification passed",
    "desktop and mobile HTML verification passed",
    "repository-state resume and delegation tests passed",
    "25 repository-level cross-harness pilot combinations passed",
    "Pi, OpenCode, and Codex native pilots externally verified",
    "human release-review protocol and evidence schema prepared"
  ],
  "currentState": "1.0.0-rc.1 has complete technical and Phase 9 acceptance; authorized human release gates remain",
  "nextAction": "Execute TASK-2026-003 with a reviewer-authorized non-synthetic story",
  "files": [
    "docs/agent/current-state.md",
    "tasks/TASK-2026-001.state.json",
    "reports/completion-report.json",
    "reports/native-conformance-pilots.json",
    "reports/human-release-review.json",
    "docs/agent/human-release-review.md"
  ],
  "evidence": [
    "npm run agents:verify",
    "clean detached worktree verification"
  ],
  "risks": [
    "Claude Code HTTP 401 is covered by an explicit owner-approved deterministic fallback",
    "Native Cursor CLI is unavailable; deterministic smoke is the approved fallback",
    "Stable release is blocked on subjective story quality and operational usability review"
  ],
  "blockers": [
    "Human review requires an authorized reviewer and a non-synthetic story they are authorized to use"
  ]
}
